{
  "specversion": "1.0",
  "esipversion": "0.1",
  "id": "result-state-1",
  "source": "esip://luanti/world-alpha",
  "type": "io.evolution.state.snapshot.v1",
  "kind": "result",
  "time": "2026-07-17T00:00:02.030Z",
  "subject": "actor/player-42",
  "target": "esip://web/control-panel",
  "datacontenttype": "application/json",
  "dataschema": "https://git-hpw.github.io/EvolutionSandbox/esip/schemas/state-snapshot-v1.schema.json",
  "sequence": 2,
  "correlationid": "origin-session-1",
  "causationid": "query-state-1",
  "data": {
    "context": {
      "universeId": "universe-1",
      "timelineId": "origin",
      "realmId": "origin_0d",
      "actorId": "player-42"
    },
    "respondingTo": "query-state-1",
    "revision": 1,
    "state": {
      "schema": 1,
      "phase": "origin_0d",
      "dimension": 0,
      "energy": 24,
      "information": 3,
      "entropy": 2,
      "stability": 11,
      "fragments": 0,
      "timeline": "origin",
      "steps": 1
    }
  }
}
