{
  "specversion": "1.0",
  "esipversion": "0.1",
  "id": "event-timeline-1",
  "source": "esip://luanti/world-alpha",
  "type": "io.evolution.timeline.created.v1",
  "kind": "event",
  "time": "2026-07-17T00:00:11.000Z",
  "subject": "actor/actor-42",
  "datacontenttype": "application/json",
  "dataschema": "https://git-hpw.github.io/EvolutionSandbox/esip/schemas/timeline-created-v1.schema.json",
  "sequence": 10,
  "correlationid": "origin-session-1",
  "data": {
    "context": {
      "universeId": "universe-1",
      "timelineId": "alpha-1",
      "realmId": "first_3d",
      "actorId": "actor-42"
    },
    "parentTimelineId": "origin",
    "newTimelineId": "alpha-1",
    "branchRevision": 8
  }
}
